### ISSUE TITLE
关于实现更强大的二层网络支持（TAP模式/虚拟交换机）的建议和讨论

### ISSUE THREAD

**Issue by daiaji** [snltty/linker#45]
Hey 作者大大，你好！

先吹一波彩虹屁，`linker`真心是个非常棒的项目，功能强大，想法新颖，解决了我很多组网的痛点。最近我在尝试一个稍微进阶点的用法时，遇到了一些挑战，也发现当前`linker`在二层网络支持上的一些局限性，想跟你深入聊聊，也希望能给项目未来的发展提点小建议。

#### 我的目标：组建一个能跑WS-Discovery的“大内网”

我的核心需求其实挺简单的：**我想让分布在两个不同物理网络（A点和B点）的设备，能够像在同一个局-域网里一样互相进行二层发现。**

具体场景就是跑 **ONVIF 协议的 WS-Discovery**，这个协议依赖UDP组播来发现网络摄像头等设备。本质上，我需要把A点和B点的局域网“拉平”，整合成一个大的虚拟二层网络。

#### 我的折腾之旅（和踩过的坑）

`linker`已经提供了超好用的TUN虚拟网卡，于是我的第一反应就是基于它来构建一个L2 over L3的网络。我选择了经典的 `VXLAN` + `Bridge` 方案：

1.  **打通三层**：`linker`正常运行，A点（`10.18.18.2`）和B点（`10.18.18.3`）的`linker`虚拟网卡可以互相ping通，一切正常。
2.  **建立VXLAN隧道**：在A点和B点都创建 `vxlan0` 接口，`local`和`remote`分别指向对方的`linker` IP。
3.  **桥接网络**：这是关键一步，我尝试把各自的`vxlan0`接口和物理网络的网桥`br0`桥接起来，命令类似：`sudo ip link set vxlan0 master br0`。

然后...“灾难”发生了。😂

#### 我遇到的困境：喜提广播风暴 & STP的“无情”阻断

*   **困境一：直接桥接 -> 广播风暴 -> 网络卡死**
    只要一执行桥接命令，整台机器的网络（甚至物理局域网）就瞬间卡死，CPU飙升。`linker`的日志里疯狂刷 `tunnel connection dispose`。经过一番研究和您的帮助，我们定位到了原因：这是一个教科书式的**二层网络环路**。广播包在 `br0 -> vxlan0 -> linker隧道 -> 对端br0 -> ...` 这个路径里无限循环，形成了广播风暴。

*   **困境二：`linker`的广播转发问题**
    我们发现`linker`默认会转发它从TUN网卡收到的广播包。我尝试通过配置里的`TuntapSwitch.Multicast = 16`来禁用这个行为，但奇怪的是，问题依旧。这让我觉得，单纯在`linker`层面控制广播可能还不够，问题可能更底层。

*   **困境三：启用STP -> 端口被阻塞**
    作为标准解法，我在网桥上开启了STP（`brctl stp br0 on`）。这下网络不卡死了，但新的问题来了：`dmesg`日志显示，无论是`vxlan0`还是后来尝试的`veth`接口，只要它们间接连接到了`linker`的虚拟网络，就会被STP识别为有风险的链路，然后**永久性地置于`blocking`（阻塞）状态**。STP成功阻止了风暴，但也把我的二层隧道给“掐死”了。

这让我得出一个结论：**Linux内核的网桥和STP模块，似乎和`linker`这种由用户空间程序驱动的TUN设备“八字不合”**。内核期望端口能以极高速度和标准协议进行响应，而`linker`这条路径经过了用户态切换和程序处理，无法满足STP的严格要求，最终被“嫌弃”并隔离了。

#### 我的终极建议：让 Linker 成为一个真正的“二层VPN”！

既然强行模拟二层行不通，那有没有可能让`linker`从基因层面就支持二层呢？

1.  **从TUN到TAP**：将底层的虚拟网卡从TUN（三层IP包）升级为**TAP（二层以太网帧）**。这样`linker`就能直接处理包含MAC地址的完整数据帧了。

2.  **内置虚拟交换机**：`linker`程序内部实现一个轻量级的虚拟交换机逻辑。
    *   **MAC地址学习**：知道哪个MAC地址在哪个对端`linker`节点后面。
    *   **智能转发**：收到单播帧时，精确地只发给目标隧道；收到广播/组播/未知单播帧时，才泛洪给所有其他节点。
    *   **自带防环**：实现简单的“水平分割”（Split Horizon）规则，即从一个隧道来的广播，不再转发给其他隧道，从根本上杜绝广播风暴。

如果`linker`能实现这个，那我上面的所有复杂操作就都烟消云散了。我只需要在两台机器上启动`linker`，然后简单地把`linkertap0`网卡桥接到本地`br0`，就大功告成了！这对于所有有二层组网需求（比如游戏联机、物联网设备发现、异地组建家庭内网）的用户来说，绝对是**史诗级的体验提升**。

我知道这可能是一个巨大的工程，涉及到核心架构的改动。但这绝对是一个非常有价值的演进方向，能让`linker`的应用场景再上一个大台阶。

目前，我暂时会采用**组播代理（igmpproxy）**的方案来绕过这个问题，但还是非常期待`linker`未来能在二层支持上变得更强大。

感谢你创造了这么酷的工具，也希望能听到你对这个想法的看法！

辛苦了！

**Comment by snltty** [comment]
待我仔细分析分析

**Comment by snltty** [comment]
组网后，onvif 的WS-Discovery是可以直接发现设备的，不太明白为何需要`VXLAN+Bridge `

**Comment by daiaji** [comment]
> 组网后，onvif 的WS-Discovery是可以直接发现设备的，不太明白为何需要`VXLAN+Bridge `

<img width="1005" height="504" alt="Image" src="https://github.com/user-attachments/assets/01d400c1-673f-41d5-8918-dbb284f39841" />

### A点日志

```log
[INFO   ][2025-08-02 01:49:27]:start client web
[WARNING][2025-08-02 01:49:27]:client web listen:1804
[INFO   ][2025-08-02 01:49:27]:tunnel route level getting.
[WARNING][2025-08-02 01:49:27]:route ips:10.10.10.1
[WARNING][2025-08-02 01:49:27]:tunnel local ip6 :240e:xxxx:xxxx:9000::c6c,240e:xxxx:xxxx:9000:xxxx:xxxx:xxxx:9659,240e:xxxx:xxxx:9000:xxxx:xxxx:xxxx:65e2
[WARNING][2025-08-02 01:49:27]:tunnel local ip4 :10.10.10.11,10.18.18.2
[WARNING][2025-08-02 01:49:27]:tunnel route level:2
[INFO   ][2025-08-02 01:49:27]:start signin
[INFO   ][2025-08-02 01:49:27]:start signin transfer
[WARNING][2025-08-02 01:49:27]:current version : v1.8.9
[WARNING][2025-08-02 01:49:27]:linker env is docker : linker
[WARNING][2025-08-02 01:49:27]:linker env os : Alpine Linux v3.22
[DEBUG  ][2025-08-02 01:49:27]:linker are running....
[INFO   ][2025-08-02 01:49:27]:tunnel route level getting.
[WARNING][2025-08-02 01:49:28]:route ips:10.10.10.1
[WARNING][2025-08-02 01:49:28]:tunnel local ip6 :240e:xxxx:xxxx:9000::c6c,240e:xxxx:xxxx:9000:xxxx:xxxx:xxxx:9659,240e:xxxx:xxxx:9000:xxxx:xxxx:xxxx:65e2
[WARNING][2025-08-02 01:49:28]:tunnel local ip4 :10.10.10.11,10.18.18.2
[WARNING][2025-08-02 01:49:28]:tunnel route level:2
[ERROR  ][2025-08-02 01:50:05]:tunnel connection disponse 4
```

---

### B点日志

```log
[INFO   ][2025-08-02 01:49:27]:start client web
[WARNING][2025-08-02 01:49:27]:client web listen:1804
[INFO   ][2025-08-02 01:49:27]:tunnel route level getting.
[WARNING][2025-08-02 01:49:32]:route ips:192.168.4.1,192.168.1.1,100.64.x.x
[WARNING][2025-08-02 01:49:32]:tunnel local ip6 :240e:xxxx:xxxx:7501::105c,240e:xxxx:xxxx:7501:xxxx:xxxx:xxxx:dde2,240e:xxxx:xxxx:7501:xxxx:xxxx:xxxx:3bdf
[WARNING][2025-08-02 01:49:32]:tunnel local ip4 :127.0.1.1,192.168.4.98,10.0.0.9,10.18.18.3
[WARNING][2025-08-02 01:49:32]:tunnel route level:4
[INFO   ][2025-08-02 01:49:32]:start signin
[INFO   ][2025-08-02 01:49:32]:start signin transfer
[WARNING][2025-08-02 01:49:32]:current version : v1.8.9
[WARNING][2025-08-02 01:49:32]:linker env is docker : linker
[WARNING][2025-08-02 01:49:32]:linker env os : Alpine Linux v3.22
[DEBUG  ][2025-08-02 01:49:32]:linker are running....
[INFO   ][2025-08-02 01:49:33]:tunnel route level getting.
[WARNING][2025-08-02 01:49:36]:route ips:192.168.4.1,192.168.1.1,100.64.x.x
[WARNING][2025-08-02 01:49:36]:tunnel local ip6 :240e:xxxx:xxxx:7501::105c,240e:xxxx:xxxx:7501:xxxx:xxxx:xxxx:dde2,240e:xxxx:xxxx:7501:xxxx:xxxx:xxxx:3bdf
[WARNING][2025-08-02 01:49:36]:tunnel local ip4 :127.0.1.1,192.168.4.98,10.0.0.9,10.18.18.3
[WARNING][2025-08-02 01:49:36]:tunnel route level:4
```

#### A点 (服务器/发送端)

```text
1: lo: <LOOPBACK,UP,LOWER_UP> mtu 65536 qdisc noqueue state UNKNOWN group default qlen 1000
    link/loopback 00:00:00:00:00:00 brd 00:00:00:00:00:00
    inet 127.0.0.1/8 scope host lo
       valid_lft forever preferred_lft forever
    inet6 ::1/128 scope host noprefixroute 
       valid_lft forever preferred_lft forever
2: enp39s0: <BROADCAST,MULTICAST,UP,LOWER_UP> mtu 1500 qdisc fq_codel master br0 state UP group default qlen 1000
    link/ether XX:XX:XX:XX:C7:3B brd ff:ff:ff:ff:ff:ff
3: enp38s0: <BROADCAST,MULTICAST> mtu 1500 qdisc noop state DOWN group default qlen 1000
    link/ether XX:XX:XX:XX:C7:3C brd ff:ff:ff:ff:ff:ff
4: br0: <BROADCAST,MULTICAST,UP,LOWER_UP> mtu 1500 qdisc noqueue state UP group default qlen 1000
    link/ether XX:XX:XX:XX:C7:3B brd ff:ff:ff:ff:ff:ff
    inet 10.10.10.11/24 metric 1024 brd 10.10.10.255 scope global dynamic br0
       valid_lft 37229sec preferred_lft 37229sec
    inet6 240e:xxxx:xxxx:9000::c6c/128 scope global dynamic noprefixroute 
       valid_lft 1784sec preferred_lft 1784sec
    inet6 fd3c:xxxx:xxxx::c6c/128 scope global dynamic noprefixroute 
       valid_lft 43133sec preferred_lft 1784sec
    inet6 fd3c:xxxx:xxxx:0:xxxx:xxxx:xxxx:dcba/64 scope global temporary dynamic 
       valid_lft 577230sec preferred_lft 58823sec
    inet6 fd3c:xxxx:xxxx:0:xxxx:xxxx:xxxx:5cf3/64 scope global mngtmpaddr noprefixroute 
       valid_lft forever preferred_lft 604492sec
    inet6 240e:xxxx:xxxx:9000:xxxx:xxxx:xxxx:698e/64 scope global temporary dynamic 
       valid_lft 1785sec preferred_lft 1783sec
    inet6 240e:xxxx:xxxx:9000:xxxx:xxxx:xxxx:65e2/64 scope global dynamic mngtmpaddr noprefixroute 
       valid_lft 1785sec preferred_lft 1783sec
    inet6 fe80::xxxx:xxff:fexx:c73b/64 scope link proto kernel_ll 
       valid_lft forever preferred_lft forever
5: br1: <BROADCAST,MULTICAST,UP,LOWER_UP> mtu 1500 qdisc noqueue state UNKNOWN group default qlen 1000
    link/ether YY:YY:YY:YY:DF:A7 brd ff:ff:ff:ff:ff:ff
    inet6 fe80::yyyy:ycff:feyy:dfa7/64 scope link proto kernel_ll 
       valid_lft forever preferred_lft forever
6: linker: <POINTOPOINT,MULTICAST,NOARP,UP,LOWER_UP> mtu 1420 qdisc fq_codel state UP group default qlen 500
    link/none 
    inet 10.18.18.2/24 scope global linker
       valid_lft forever preferred_lft forever
    inet6 fe80::xxxx:xxxx:xxxx:a524/64 scope link stable-privacy proto kernel_ll 
       valid_lft forever preferred_lft forever
```

---

#### B点 (客户端/接收端)

```text
1: lo: <LOOPBACK,UP,LOWER_UP> mtu 65536 qdisc noqueue state UNKNOWN group default qlen 1000
    link/loopback 00:00:00:00:00:00 brd 00:00:00:00:00:00
    inet 127.0.0.1/8 scope host lo
       valid_lft forever preferred_lft forever
    inet6 ::1/128 scope host noprefixroute 
       valid_lft forever preferred_lft forever
2: br0: <BROADCAST,MULTICAST,UP,LOWER_UP> mtu 1500 qdisc noqueue state UP group default qlen 1000
    link/ether ZZ:ZZ:ZZ:ZZ:37:F1 brd ff:ff:ff:ff:ff:ff
    inet 192.168.4.98/22 metric 1024 brd 192.168.7.255 scope global dynamic br0
       valid_lft 1753sec preferred_lft 1753sec
    inet6 240e:xxxx:xxxx:7501::105b/128 scope global dynamic noprefixroute 
       valid_lft 1508sec preferred_lft 1508sec
    inet6 240e:xxxx:xxxx:7501:xxxx:xxxx:xxxx:f6f4/64 scope global temporary dynamic 
       valid_lft 1592sec preferred_lft 1592sec
    inet6 240e:xxxx:xxxx:7501:xxxx:xxxx:xxxx:3bdf/64 scope global dynamic mngtmpaddr noprefixroute 
       valid_lft 1592sec preferred_lft 1592sec
    inet6 fe80::zzzz:zzff:fezz:37f1/64 scope link proto kernel_ll 
       valid_lft forever preferred_lft forever
3: wg0: <POINTOPOINT,NOARP,UP,LOWER_UP> mtu 1420 qdisc noqueue state UNKNOWN group default qlen 1000
    link/none 
    inet 10.0.0.9/24 scope global wg0
       valid_lft forever preferred_lft forever
    inet6 fdc9:xxxx:xxxx:9ee9::9/64 scope global 
       valid_lft forever preferred_lft forever
4: enp3s0: <BROADCAST,MULTICAST,UP,LOWER_UP> mtu 1500 qdisc fq_codel master br0 state UP group default qlen 1000
    link/ether ZZ:ZZ:ZZ:ZZ:37:F1 brd ff:ff:ff:ff:ff:ff
5: vnet0: <BROADCAST,MULTICAST,UP,LOWER_UP> mtu 1500 qdisc noqueue master br0 state UNKNOWN group default qlen 1000
    link/ether fe:54:00:xx:xx:e6 brd ff:ff:ff:ff:ff:ff
    inet6 fe80::fc54:ff:fexx:f7e6/64 scope link proto kernel_ll 
       valid_lft forever preferred_lft forever
6: linker: <POINTOPOINT,MULTICAST,NOARP,UP,LOWER_UP> mtu 1420 qdisc fq_codel state UP group default qlen 500
    link/none 
    inet 10.18.18.3/24 scope global linker
       valid_lft forever preferred_lft forever
    inet6 fe80::xxxx:xxxx:xxxx:9153/64 scope link stable-privacy proto kernel_ll 
       valid_lft forever preferred_lft forever
```

```
// ws_discovery_scanner_demo.go
// 这是一个独立的 Go 程序，用于演示如何使用 WS-Discovery 协议扫描局域网内的 ONVIF 设备。
//
// 如何运行:
// 1. 确保你已经安装了 Go 语言环境。
// 2. 安装所需的依赖库: go get github.com/google/uuid
// 3. 在终端中运行此文件: go run ws_discovery_scanner_demo.go
//
package main

import (
	"bytes"
	"encoding/xml"
	"fmt"
	"log"
	"net"
	"net/url"
	"strings"
	"text/template"
	"time"

	"github.com/google/uuid"
)

// --- 用于解析 WS-Discovery 响应的XML结构体 ---
// 这些结构体直接从您的项目中提取，用于反序列化设备返回的SOAP消息。

type Envelope struct {
	XMLName xml.Name `xml:"Envelope"`
	Header  Header   `xml:"Header"`
	Body    Body     `xml:"Body"`
}

type Header struct {
	XMLName   xml.Name `xml:"Header"`
	RelatesTo string   `xml:"RelatesTo"`
}

type Body struct {
	XMLName      xml.Name     `xml:"Body"`
	ProbeMatches []ProbeMatch `xml:"ProbeMatches>ProbeMatch"`
}

type ProbeMatch struct {
	XMLName           xml.Name          `xml:"ProbeMatch"`
	EndpointReference EndpointReference `xml:"EndpointReference"`
	XAddrs            string            `xml:"XAddrs"`
	Scopes            string            `xml:"Scopes"`
}

type EndpointReference struct {
	Address string `xml:"Address"`
}

// --- WS-Discovery 核心常量和模板 ---

const (
	// wsdAddress 是 WS-Discovery 标准的多播地址和端口。
	wsdAddress = "239.255.255.250:3702"

	// probeTemplate 是发送给网络以发现设备的 SOAP Probe 消息模板。
	probeTemplate = `
<?xml version="1.0" encoding="UTF-8"?>
<soap:Envelope xmlns:soap="http://www.w3.org/2003/05/soap-envelope"
               xmlns:wsa="http://schemas.xmlsoap.org/ws/2004/08/addressing"
               xmlns:wsd="http://schemas.xmlsoap.org/ws/2005/04/discovery">
    <soap:Header>
        <wsa:To>urn:schemas-xmlsoap-org:ws:2005:04:discovery</wsa:To>
        <wsa:Action>http://schemas.xmlsoap.org/ws/2005/04/discovery/Probe</wsa:Action>
        <wsa:MessageID>urn:uuid:{{.MessageID}}</wsa:MessageID>
    </soap:Header>
    <soap:Body>
        <wsd:Probe>
            <wsd:Types>dn:NetworkVideoTransmitter</wsd:Types>
        </wsd:Probe>
    </soap:Body>
</soap:Envelope>`
)

// ScanNetwork 向局域网发送 WS-Discovery Probe 请求并收集响应。
// 返回的是原始的 ProbeMatch 结构体切片。
func ScanNetwork(timeout time.Duration) ([]ProbeMatch, error) {
	// 1. 解析多播地址
	addr, err := net.ResolveUDPAddr("udp", wsdAddress)
	if err != nil {
		return nil, fmt.Errorf("解析多播地址失败: %w", err)
	}

	// 2. 创建一个用于发送和接收UDP包的连接
	conn, err := net.ListenPacket("udp", ":0") // 在任意可用端口上监听
	if err != nil {
		return nil, fmt.Errorf("创建 UDP 连接失败: %w", err)
	}
	defer conn.Close()

	// 3. 准备要发送的 Probe 消息
	messageID := uuid.New().String()
	tmpl, _ := template.New("probe").Parse(probeTemplate)
	var probeBuf bytes.Buffer
	if err := tmpl.Execute(&probeBuf, struct{ MessageID string }{MessageID: messageID}); err != nil {
		return nil, fmt.Errorf("执行 Probe 模板失败: %w", err)
	}

	// 4. 将 Probe 消息发送到多播地址
	log.Println("正在向局域网发送发现探测(Probe)消息...")
	_, err = conn.WriteTo(probeBuf.Bytes(), addr)
	if err != nil {
		return nil, fmt.Errorf("发送 Probe 消息失败: %w", err)
	}

	// 5. 设置读取超时，这是扫描持续时间的控制点
	if err := conn.SetReadDeadline(time.Now().Add(timeout)); err != nil {
		return nil, fmt.Errorf("设置读取超时失败: %w", err)
	}

	var discoveredMatches []ProbeMatch
	receivedFrom := make(map[string]bool) // 用于防止重复处理来自同一IP的响应

	log.Printf("开始监听响应，持续 %v...", timeout)
	for {
		// 6. 循环读取响应
		buf := make([]byte, 8192) // 足够大的缓冲区
		n, remoteAddr, err := conn.ReadFrom(buf)
		if err != nil {
			// 如果错误是超时，说明扫描时间已到，是正常结束
			if netErr, ok := err.(net.Error); ok && netErr.Timeout() {
				break
			}
			log.Printf("读取响应时发生错误: %v, 继续...", err)
			continue
		}

		// 每个IP只处理一次首次响应
		if receivedFrom[remoteAddr.String()] {
			continue
		}
		receivedFrom[remoteAddr.String()] = true
		log.Printf("从 %s 收到响应...", remoteAddr.String())

		// 7. 解析收到的 XML 数据
		var envelope Envelope
		if err := xml.Unmarshal(buf[:n], &envelope); err != nil {
			log.Printf("解析来自 %s 的XML失败: %v", remoteAddr.String(), err)
			continue
		}

		// 8. 验证响应是否与我们的请求相关
		if !strings.Contains(envelope.Header.RelatesTo, messageID) {
			log.Printf("收到一个无关的响应 (MessageID不匹配)，已忽略。")
			continue
		}

		// 9. 将有效的设备信息添加到结果列表中
		if len(envelope.Body.ProbeMatches) > 0 {
			discoveredMatches = append(discoveredMatches, envelope.Body.ProbeMatches...)
		}
	}

	return discoveredMatches, nil
}

// getIPFromXAddrs 是一个辅助函数，用于从 XAddrs 字段中提取IP地址。
func getIPFromXAddrs(xaddrs string) string {
	if xaddrs == "" {
		return "N/A"
	}
	// XAddrs 可能包含多个地址，我们取第一个
	firstAddr := strings.Fields(xaddrs)[0]
	parsedURL, err := url.Parse(firstAddr)
	if err != nil {
		return "Invalid"
	}
	return parsedURL.Hostname()
}

// main 函数是程序的入口点
func main() {
	scanTimeout := 5 * time.Second // 设置扫描持续时间为5秒
	fmt.Printf("开始进行 WS-Discovery 扫描 (超时时间: %v)...\n", scanTimeout)

	// 调用核心扫描函数
	matches, err := ScanNetwork(scanTimeout)
	if err != nil {
		log.Fatalf("扫描网络时出错: %v", err)
	}

	// 检查并打印结果
	if len(matches) == 0 {
		fmt.Println("\n扫描完成，未发现任何ONVIF设备响应。")
		fmt.Println("💡 请检查: 1. 本机与设备是否在同一局域网; 2. 防火墙是否允许UDP多播;")
		return
	}

	fmt.Printf("\n扫描完成！发现 %d 个设备响应：\n", len(matches))
	for i, match := range matches {
		ip := getIPFromXAddrs(match.XAddrs)
		fmt.Println("========================================")
		fmt.Printf("设备 #%d\n", i+1)
		fmt.Println("----------------------------------------")
		fmt.Printf("  [>] IP 地址:         %s\n", ip)
		fmt.Printf("  [>] 设备 UUID:       %s\n", match.EndpointReference.Address)
		fmt.Printf("  [>] 服务地址 (XAddrs): %s\n", match.XAddrs)
		fmt.Printf("  [>] Scopes:\n")
		// 将 Scopes 字符串按空格分割，并逐行打印，更易读
		for _, scope := range strings.Fields(match.Scopes) {
			// 尝试对 scope 进行 URL 解码，使其更具可读性
			decodedScope, err := url.PathUnescape(scope)
			if err != nil {
				decodedScope = scope // 解码失败则使用原始内容
			}
			fmt.Printf("      - %s\n", decodedScope)
		}
	}
	fmt.Println("========================================")
}
```
```
go run ./ws_discovery_scanner_demo.go
开始进行 WS-Discovery 扫描 (超时时间: 5s)...
2025/08/02 01:45:58 正在向局域网发送发现探测(Probe)消息...
2025/08/02 01:45:58 开始监听响应，持续 5s...

扫描完成，未发现任何ONVIF设备响应。
💡 请检查: 1. 本机与设备是否在同一局域网; 2. 防火墙是否允许UDP多播;
```
这基本上我那个go程序的demo。
我在A点进行发现，并不能发现到B点br0局域网下的任何设备。
B点发现就没有任何问题。

**Comment by snltty** [comment]
根据群友的讨论，需要路由支持IGMP才能使用跨网段多播，设备是否支持IGMP？

**Comment by daiaji** [comment]
> 根据群友的讨论，需要路由支持IGMP才能使用跨网段多播，设备是否支持IGMP？

```
ip maddr show
1:      lo
        inet  224.0.0.1
        inet6 ff02::1
        inet6 ff01::1
2:      br0
        link  33:33:00:00:00:01
        link  01:00:5e:00:00:6a
        link  33:33:00:00:00:6a
        link  01:00:5e:00:00:01
        link  33:33:ff:xx:xx:xx
        link  33:33:00:01:00:03
        link  33:33:00:00:00:fb
        link  01:00:5e:00:00:fc
        link  01:00:5e:00:00:fb
        link  33:33:ff:xx:xx:xx
        link  33:33:ff:xx:xx:xx
        link  33:33:ff:xx:xx:xx
        link  01:00:5e:00:00:02
        link  01:00:5e:00:00:16
        link  01:00:5e:7f:ff:fa
        inet  239.255.255.250 users 4
        inet  224.0.0.22
        inet  224.0.0.2
        inet  224.0.0.251
        inet  224.0.0.252
        inet  224.0.0.1
        inet  224.0.0.106
        inet6 ff02::1:ffxx:xxxx
        inet6 ff02::1:ffxx:xxxx
        inet6 ff02::1:ffxx:xxxx
        inet6 ff02::fb
        inet6 ff02::1:3
        inet6 ff02::1:ffxx:xxxx
        inet6 ff02::6a
        inet6 ff02::1 users 2
        inet6 ff01::1
3:      wg0
        inet  224.0.0.1
        inet6 ff02::fb users 2
        inet6 ff02::1
        inet6 ff01::1
4:      enp3s0
        link  33:33:00:00:00:01
        link  01:00:5e:00:00:01
        link  01:80:c2:00:00:00
        link  01:80:c2:00:00:03
        link  01:80:c2:00:00:0e
        inet  224.0.0.1
        inet6 ff02::1
        inet6 ff01::1
5:      vnet0
        link  33:33:00:00:00:01
        link  01:00:5e:00:00:01
        link  33:33:ff:xx:xx:xx
        link  33:33:00:01:00:03
        link  33:33:00:00:00:fb
        inet  224.0.0.1
        inet6 ff02::fb
        inet6 ff02::1:3
        inet6 ff02::1:ffxx:xxxx
        inet6 ff02::1
        inet6 ff01::1
6:      linker
        inet  239.255.255.251
        inet  239.255.255.250
        inet  224.0.0.251 users 2
        inet  224.0.0.252 users 2
        inet  224.0.0.1
        inet6 ff02::fb
        inet6 ff02::1:3
        inet6 ff02::1
        inet6 ff01::1
```
```
quickleave
phyint linker upstream
phyint br0 downstream
```
b点的maddr信息，然后我用这个配置配置过igmpproxy。
没啥用。

**Comment by snltty** [comment]
需要路由或核心交换机支持IGMP

**Comment by snltty** [comment]
我去了解了一下，总结了你的问题
因为你路由设备不支持igmp，所以你组网后使用onvif WS-Discovery 无法发现设备，因此需要igmpproxy或mcproxy这样的代理工具

**Comment by daiaji** [comment]
B点的抓包
```
sudo tcpdump -i linker -n 'udp and port 3702'
tcpdump: verbose output suppressed, use -v[v]... for full protocol decode
listening on linker, link-type RAW (Raw IP), snapshot length 262144 bytes
20:57:17.665801 IP 10.18.18.2.60220 > 239.255.255.250.3702: UDP, length 691
^C
1 packet captured
1 packet received by filter
0 packets dropped by kernel
```
```
sudo tcpdump -i br0 -n 'udp and port 3702'
tcpdump: verbose output suppressed, use -v[v]... for full protocol decode
listening on br0, link-type EN10MB (Ethernet), snapshot length 262144 bytes
20:57:17.665866 IP 192.168.4.98.60220 > 239.255.255.250.3702: UDP, length 691
20:57:17.669672 IP 192.168.5.18.3702 > 192.168.4.98.60220: UDP, length 1370
20:57:17.670424 IP 192.168.5.17.3702 > 192.168.4.98.60220: UDP, length 1371
20:57:17.670472 IP 192.168.5.21.3702 > 192.168.4.98.60220: UDP, length 1370
20:57:17.671030 IP 192.168.5.19.3702 > 192.168.4.98.60220: UDP, length 1371
20:57:17.672442 IP 192.168.7.254.3702 > 192.168.4.98.60220: UDP, length 1373
20:57:17.672943 IP 192.168.5.22.3702 > 192.168.4.98.60220: UDP, length 1371
20:57:17.673741 IP 192.168.5.23.3702 > 192.168.4.98.60220: UDP, length 1370
20:57:17.673820 IP 192.168.5.3.3702 > 192.168.4.98.60220: UDP, length 1320
20:57:17.673820 IP 192.168.5.193.3702 > 192.168.4.98.60220: UDP, length 3273
20:57:17.674120 IP 192.168.5.15.3702 > 192.168.4.98.60220: UDP, length 1375
20:57:17.674212 IP 192.168.5.191.3702 > 192.168.4.98.60220: UDP, length 3273
20:57:17.674463 IP 192.168.5.20.3702 > 192.168.4.98.60220: UDP, length 1375
20:57:17.675267 IP 192.168.5.9.3702 > 192.168.4.98.60220: UDP, length 1369
20:57:17.676017 IP 192.168.5.206.3702 > 192.168.4.98.60220: UDP, length 3320
20:57:17.676203 IP 192.168.5.190.3702 > 192.168.4.98.60220: UDP, length 3273
20:57:17.676444 IP 192.168.5.241.3702 > 192.168.4.98.60220: UDP, length 3285
20:57:17.676823 IP 192.168.5.204.3702 > 192.168.4.98.60220: UDP, length 3316
20:57:17.677082 IP 192.168.5.16.3702 > 192.168.4.98.60220: UDP, length 1370
20:57:17.677156 IP 192.168.5.5.3702 > 192.168.4.98.60220: UDP, length 1320
20:57:17.677601 IP 192.168.5.6.3702 > 192.168.4.98.60220: UDP, length 1335
20:57:17.677802 IP 192.168.5.14.3702 > 192.168.4.98.60220: UDP, length 1375
20:57:17.677836 IP 192.168.5.211.3702 > 192.168.4.98.60220: UDP, length 3316
20:57:17.677861 IP 192.168.5.13.3702 > 192.168.4.98.60220: UDP, length 1375
20:57:17.678779 IP 192.168.5.215.3702 > 192.168.4.98.60220: UDP, length 3286
20:57:17.678895 IP 192.168.5.4.3702 > 192.168.4.98.60220: UDP, length 1320
20:57:17.680055 IP 192.168.5.240.3702 > 192.168.4.98.60220: UDP, length 3287
20:57:17.680109 IP 192.168.5.8.3702 > 192.168.4.98.60220: UDP, length 1352
20:57:17.680146 IP 192.168.5.207.3702 > 192.168.4.98.60220: UDP, length 3288
20:57:17.680416 IP 192.168.5.209.3702 > 192.168.4.98.60220: UDP, length 3316
20:57:17.680440 IP 192.168.5.24.3702 > 192.168.4.98.60220: UDP, length 1370
20:57:17.680598 IP 192.168.5.192.3702 > 192.168.4.98.60220: UDP, length 3320
20:57:17.680695 IP 192.168.5.213.3702 > 192.168.4.98.60220: UDP, length 3320
20:57:17.680841 IP 192.168.5.218.3702 > 192.168.4.98.60220: UDP, length 3096
20:57:17.681122 IP 192.168.5.216.3702 > 192.168.4.98.60220: UDP, length 3288
20:57:17.681578 IP 192.168.5.201.3702 > 192.168.4.98.60220: UDP, length 3320
20:57:17.681661 IP 192.168.5.203.3702 > 192.168.4.98.60220: UDP, length 3286
20:57:17.681867 IP 192.168.5.120.3702 > 192.168.4.98.60220: UDP, length 3320
20:57:17.682147 IP 192.168.5.12.3702 > 192.168.4.98.60220: UDP, length 1375
20:57:17.683071 IP 192.168.5.208.3702 > 192.168.4.98.60220: UDP, length 3316
20:57:17.683272 IP 192.168.5.242.3702 > 192.168.4.98.60220: UDP, length 3288
20:57:17.683394 IP 192.168.5.202.3702 > 192.168.4.98.60220: UDP, length 3320
20:57:17.683509 IP 192.168.5.11.3702 > 192.168.4.98.60220: UDP, length 1371
20:57:17.684345 IP 192.168.5.212.3702 > 192.168.4.98.60220: UDP, length 3316
20:57:17.684345 IP 192.168.5.7.3702 > 192.168.4.98.60220: UDP, length 1352
20:57:17.684656 IP 192.168.5.214.3702 > 192.168.4.98.60220: UDP, length 3320
20:57:17.684780 IP 192.168.5.199.3702 > 192.168.4.98.60220: UDP, length 3316
20:57:17.685177 IP 192.168.5.2.3702 > 192.168.4.98.60220: UDP, length 1353
20:57:17.685337 IP 192.168.5.210.3702 > 192.168.4.98.60220: UDP, length 3320
20:57:17.685629 IP 192.168.5.238.3702 > 192.168.4.98.60220: UDP, length 3286
20:57:17.688277 IP 192.168.5.132.3702 > 192.168.4.98.60220: UDP, length 3319
20:57:17.690748 IP 192.168.5.122.3702 > 192.168.4.98.60220: UDP, length 3271
20:57:17.697091 IP 192.168.5.217.3702 > 192.168.4.98.60220: UDP, length 3273
20:57:17.697698 IP 192.168.5.205.3702 > 192.168.4.98.60220: UDP, length 3271
20:57:17.701978 IP 192.168.5.200.3702 > 192.168.4.98.60220: UDP, length 3271
20:57:17.705385 IP 192.168.5.92.3702 > 192.168.4.98.60220: UDP, length 1477
20:57:17.706895 IP 192.168.5.186.3702 > 192.168.4.98.60220: UDP, length 3273
20:57:17.708518 IP 192.168.5.10.3702 > 192.168.4.98.60220: UDP, length 1348
20:57:17.708785 IP 192.168.5.91.3702 > 192.168.4.98.60220: UDP, length 1480
20:57:17.709054 IP 192.168.5.94.3702 > 192.168.4.98.60220: UDP, length 1480
20:57:17.709689 IP 192.168.5.243.3702 > 192.168.4.98.60220: UDP, length 3204
20:57:17.710119 IP 192.168.5.196.3702 > 192.168.4.98.60220: UDP, length 3204
20:57:17.710478 IP 192.168.5.170.3702 > 192.168.4.98.60220: UDP, length 3204
20:57:17.710506 IP 192.168.5.111.3702 > 192.168.4.98.60220: UDP, length 3204
20:57:17.710530 IP 192.168.5.143.3702 > 192.168.4.98.60220: UDP, length 3204
20:57:17.710881 IP 192.168.5.164.3702 > 192.168.4.98.60220: UDP, length 3204
20:57:17.711071 IP 192.168.5.142.3702 > 192.168.4.98.60220: UDP, length 3204
20:57:17.711391 IP 192.168.5.104.3702 > 192.168.4.98.60220: UDP, length 3204
20:57:17.711654 IP 192.168.5.113.3702 > 192.168.4.98.60220: UDP, length 3204
20:57:17.711925 IP 192.168.5.131.3702 > 192.168.4.98.60220: UDP, length 3204
20:57:17.712049 IP 192.168.5.116.3702 > 192.168.4.98.60220: UDP, length 3204
20:57:17.712267 IP 192.168.5.156.3702 > 192.168.4.98.60220: UDP, length 3204
20:57:17.712480 IP 192.168.5.236.3702 > 192.168.4.98.60220: UDP, length 3204
20:57:17.712522 IP 192.168.5.149.3702 > 192.168.4.98.60220: UDP, length 3204
20:57:17.712596 IP 192.168.5.162.3702 > 192.168.4.98.60220: UDP, length 3204
20:57:17.712778 IP 192.168.5.117.3702 > 192.168.4.98.60220: UDP, length 3204
20:57:17.713206 IP 192.168.5.232.3702 > 192.168.4.98.60220: UDP, length 3204
20:57:17.713464 IP 192.168.5.160.3702 > 192.168.4.98.60220: UDP, length 3204
20:57:17.713841 IP 192.168.5.166.3702 > 192.168.4.98.60220: UDP, length 3205
20:57:17.714217 IP 192.168.5.157.3702 > 192.168.4.98.60220: UDP, length 3204
20:57:17.714241 IP 192.168.5.138.3702 > 192.168.4.98.60220: UDP, length 3204
20:57:17.714705 IP 192.168.5.174.3702 > 192.168.4.98.60220: UDP, length 3205
20:57:17.714932 IP 192.168.5.118.3702 > 192.168.4.98.60220: UDP, length 3204
20:57:17.715501 IP 192.168.5.176.3702 > 192.168.4.98.60220: UDP, length 3204
20:57:17.715542 IP 192.168.5.228.3702 > 192.168.4.98.60220: UDP, length 3204
20:57:17.715565 IP 192.168.5.231.3702 > 192.168.4.98.60220: UDP, length 3204
20:57:17.715588 IP 192.168.5.155.3702 > 192.168.4.98.60220: UDP, length 3204
20:57:17.715613 IP 192.168.5.148.3702 > 192.168.4.98.60220: UDP, length 3204
20:57:17.715832 IP 192.168.5.226.3702 > 192.168.4.98.60220: UDP, length 3251
20:57:17.715950 IP 192.168.5.137.3702 > 192.168.4.98.60220: UDP, length 3204
20:57:17.715974 IP 192.168.5.130.3702 > 192.168.4.98.60220: UDP, length 3204
20:57:17.716145 IP 192.168.5.222.3702 > 192.168.4.98.60220: UDP, length 3251
20:57:17.716734 IP 192.168.5.171.3702 > 192.168.4.98.60220: UDP, length 3204
20:57:17.716793 IP 192.168.5.165.3702 > 192.168.4.98.60220: UDP, length 3204
20:57:17.716901 IP 192.168.5.144.3702 > 192.168.4.98.60220: UDP, length 3204
20:57:17.717268 IP 192.168.5.146.3702 > 192.168.4.98.60220: UDP, length 3204
20:57:17.717292 IP 192.168.5.161.3702 > 192.168.4.98.60220: UDP, length 3204
20:57:17.717376 IP 192.168.5.235.3702 > 192.168.4.98.60220: UDP, length 3204
20:57:17.717452 IP 192.168.5.244.3702 > 192.168.4.98.60220: UDP, length 3204
20:57:17.717475 IP 192.168.5.173.3702 > 192.168.4.98.60220: UDP, length 3204
20:57:17.717601 IP 192.168.5.233.3702 > 192.168.4.98.60220: UDP, length 3205
20:57:17.717683 IP 192.168.5.139.3702 > 192.168.4.98.60220: UDP, length 3204
20:57:17.717841 IP 192.168.5.163.3702 > 192.168.4.98.60220: UDP, length 3204
20:57:17.718166 IP 192.168.5.110.3702 > 192.168.4.98.60220: UDP, length 3204
20:57:17.718371 IP 192.168.5.172.3702 > 192.168.4.98.60220: UDP, length 3204
20:57:17.718451 IP 192.168.5.175.3702 > 192.168.4.98.60220: UDP, length 3204
20:57:17.718473 IP 192.168.5.150.3702 > 192.168.4.98.60220: UDP, length 3204
20:57:17.718561 IP 192.168.5.106.3702 > 192.168.4.98.60220: UDP, length 3204
20:57:17.718613 IP 192.168.5.154.3702 > 192.168.4.98.60220: UDP, length 3204
20:57:17.718684 IP 192.168.5.124.3702 > 192.168.4.98.60220: UDP, length 3204
20:57:17.718729 IP 192.168.5.140.3702 > 192.168.4.98.60220: UDP, length 3204
20:57:17.718755 IP 192.168.5.220.3702 > 192.168.4.98.60220: UDP, length 3251
20:57:17.718781 IP 192.168.5.230.3702 > 192.168.4.98.60220: UDP, length 3204
20:57:17.718945 IP 192.168.5.167.3702 > 192.168.4.98.60220: UDP, length 3204
20:57:17.718967 IP 192.168.5.195.3702 > 192.168.4.98.60220: UDP, length 3204
20:57:17.718995 IP 192.168.5.219.3702 > 192.168.4.98.60220: UDP, length 3251
20:57:17.719546 IP 192.168.5.128.3702 > 192.168.4.98.60220: UDP, length 3204
20:57:17.720141 IP 192.168.5.194.3702 > 192.168.4.98.60220: UDP, length 3205
20:57:17.720175 IP 192.168.5.103.3702 > 192.168.4.98.60220: UDP, length 3204
20:57:17.720421 IP 192.168.5.114.3702 > 192.168.4.98.60220: UDP, length 3204
20:57:17.720544 IP 192.168.5.125.3702 > 192.168.4.98.60220: UDP, length 3204
20:57:17.720938 IP 192.168.5.227.3702 > 192.168.4.98.60220: UDP, length 3251
20:57:17.721010 IP 192.168.5.93.3702 > 192.168.4.98.60220: UDP, length 1483
20:57:17.721247 IP 192.168.5.169.3702 > 192.168.4.98.60220: UDP, length 3204
20:57:17.721643 IP 192.168.5.108.3702 > 192.168.4.98.60220: UDP, length 3204
20:57:17.721798 IP 192.168.5.237.3702 > 192.168.4.98.60220: UDP, length 3204
20:57:17.722357 IP 192.168.5.129.3702 > 192.168.4.98.60220: UDP, length 3204
20:57:17.723011 IP 192.168.5.168.3702 > 192.168.4.98.60220: UDP, length 3204
20:57:17.723204 IP 192.168.5.223.3702 > 192.168.4.98.60220: UDP, length 3251
20:57:17.723314 IP 192.168.5.102.3702 > 192.168.4.98.60220: UDP, length 3204
20:57:17.723366 IP 192.168.5.153.3702 > 192.168.4.98.60220: UDP, length 3204
20:57:17.724032 IP 192.168.5.158.3702 > 192.168.4.98.60220: UDP, length 3204
20:57:17.724180 IP 192.168.5.109.3702 > 192.168.4.98.60220: UDP, length 3204
20:57:17.724456 IP 192.168.5.141.3702 > 192.168.4.98.60220: UDP, length 3204
20:57:17.725103 IP 192.168.5.229.3702 > 192.168.4.98.60220: UDP, length 3204
20:57:17.725237 IP 192.168.5.133.3702 > 192.168.4.98.60220: UDP, length 3204
20:57:17.726081 IP 192.168.5.123.3702 > 192.168.4.98.60220: UDP, length 3204
20:57:17.727346 IP 192.168.5.119.3702 > 192.168.4.98.60220: UDP, length 3204
20:57:17.727692 IP 192.168.4.10.3702 > 192.168.4.98.60220: UDP, length 1382
20:57:17.729919 IP 192.168.5.145.3702 > 192.168.4.98.60220: UDP, length 3204
20:57:17.730757 IP 192.168.5.1.3702 > 192.168.4.98.60220: UDP, length 1353
20:57:17.730862 IP 192.168.5.100.3702 > 192.168.4.98.60220: UDP, length 3204
20:57:17.732276 IP 192.168.5.224.3702 > 192.168.4.98.60220: UDP, length 3204
20:57:17.733901 IP 192.168.5.152.3702 > 192.168.4.98.60220: UDP, length 3172
20:57:17.735317 IP 192.168.5.107.3702 > 192.168.4.98.60220: UDP, length 3204
20:57:17.746806 IP 192.168.5.151.3702 > 192.168.4.98.60220: UDP, length 3173
20:57:17.791675 IP 192.168.5.159.3702 > 192.168.4.98.60220: UDP, length 3173
^C
147 packets captured
147 packets received by filter
0 packets dropped by kernel

```
我开了igmpproxy，改了go代码，指定从linker进行组播。
在igmpproxy的帮助下，组播能从linker发送到br0了。
但设备返回的包没法从linker传递到br0。
LLM说是要修改LinkerSrcNat.cs，让组播也能够进行SNAT。
作者大佬怎么看？
